8	EVALUÁNDONOS 8 FINAL 2025	8-01, 8-02, 8-03, 8PJ	Primary Key 	63	B	80	86.02	0.186	B	86.02	C	8.6	D	3.23	A	2.15		9	73	Lenguaje	73.   En el afiche, las imágenes situadas sobre el cerebro humano se relacionan con el desarrollo del conocimiento a través de 	la señalización de las regiones del cerebro donde ocurren los distintos procesos mentales. 	los tonos de color gris que clasifican las características de las ciencias. 	los círculos que ilustran los pasos del método científico. 	las flechas que representan la conexión entre ideas.
8	EVALUÁNDONOS 8 FINAL 2025	8-01, 8-02, 8-03, 8PJ	Primary Key 	64	B	63	67.74	0.183	B	67.74	A	10.75	D	10.75	C	8.6		9	74	Lenguaje	74.   ¿Qué se concluye del apartado “Evolución de la Ciencia”? 	La teoría de la evolución es posterior a la teoría de la relatividad. 	La biología es la ciencia que menos ha progresado en la historia. 	La invención del álgebra es anterior a la formulación de las leyes de la física. 	La ciencia inició su proceso de evolución con la descripción del genoma humano.
8	EVALUÁNDONOS 8 FINAL 2025	8-01, 8-02, 8-03, 8PJ	Primary Key 	65	C	54	58.06	0.045	C	58.06	A	20.43	D	11.83	B	9.68		9	75	Lenguaje	75. ¿Cuál es la relación entre las imágenes de la “Evolución de la Ciencia” y el texto que las acompaña? 	Las imágenes representan los logros que se describen en el texto. 	Las imágenes representan los científicos de los que habla el texto. 	El texto describe detalladamente las imágenes que lo acompañan. 	El texto describe físicamente a los hombres que aparecen en las imágenes.
8	EVALUÁNDONOS 8 FINAL 2025	8-01, 8-02, 8-03, 8PJ	Primary Key 	66	B	48	51.61	0.296	B	51.61	D	21.51	C	20.43	A	6.45		9	76	Lenguaje	76.   De acuerdo con la información del texto y las imágenes que utiliza, ¿a quién va dirigido el texto? 	A los músicos. 	A los pintores. 	Al público general. 	A niños de preescolar
8	EVALUÁNDONOS 8 FINAL 2025	8-01, 8-02, 8-03, 8PJ	Primary Key 	67	C	27	29.03	0.407	A	36.56	C	29.03	D	19.35	B	15.05		9	77	Lenguaje	77. ¿Qué relación se establece entre el uso de insecticidas y la salud humana según la infografía?	Los insecticidas son seguros si se aplican en espacios abiertos.	Su uso es obligatorio para prevenir enfermedades como el cólera.	Aunque combaten enfermedades, pueden generar efectos adversos graves. 	Son recomendados por el Ministerio de Salud para uso doméstico frecuente.
8	EVALUÁNDONOS 8 FINAL 2025	8-01, 8-02, 8-03, 8PJ	Primary Key 	68	B	67	72.04	0.313	B	72.04	A	13.98	C	9.68	D	4.3		9	78	Lenguaje	78. ¿Qué operación discursiva realiza la infografía al incluir síntomas como “cefalea, vómito, broncoespasmo”?	Apela al miedo para disuadir el uso de insecticidas sin precaución.	Refuerza la idea de que los insecticidas son la única solución viable.	Sugiere que los síntomas son inevitables en zonas con moscas.	Minimiza los efectos secundarios para promover su comercialización.
8	EVALUÁNDONOS 8 FINAL 2025	8-01, 8-02, 8-03, 8PJ	Primary Key 	69	C	34	36.56	0.238	D	40.86	C	36.56	A	11.83	B	10.75		9	79	Lenguaje	79. ¿Qué mensaje sobre el buen comportamiento o la responsabilidad se puede sacar de las recomendaciones  que da la infografía sobre cómo usar los insecticidas?:	El cuidado ambiental debe estar por encima de la salud humana.	La responsabilidad individual es clave para evitar daños colectivos.	Las instrucciones de uso son opcionales según el contexto.	El Estado debe asumir toda la responsabilidad por los efectos adversos.
8	EVALUÁNDONOS 8 FINAL 2025	8-01, 8-02, 8-03, 8PJ	Primary Key 	70	B	20	21.51	0.218	C	66.67	B	21.51	D	7.53	A	4.3		9	80	Lenguaje	80. Lee la siguiente oración del texto: “Así que mujer no es una idea natural, es una idea social”. Teniendo en cuenta el artículo, ¿cuál de las siguientes opciones expresa lo mismo que esta oración?	La sociedad da las normas para comportarse como mujer. 	La naturaleza da las reglas para comportarse como mujer.	Es natural tener ideas acerca de cómo se porta la mujer. 	Es parte de la sociedad el querer portarse como la mujer.
8	EVALUÁNDONOS 8 FINAL 2025	8-01, 8-02, 8-03, 8PJ	Primary Key 	71	A	40	43.01	-0.019	A	43.01	C	30.11	D	15.05	B	11.83		3	11	Sociales	El presidente pertenece a la rama:	Legislativa	Judicial	Ejecutiva	Escolar
8	EVALUÁNDONOS 8 FINAL 2025	8-01, 8-02, 8-03, 8PJ	Primary Key 	72	D	7	7.53	-0.148	C	63.44	B	15.05	A	13.98	D	7.53		3	12	Sociales	El poder público busca	Desorden	Organizar el Estado	Eliminar leyes	Evitar participación
8	EVALUÁNDONOS 8 FINAL 2025	8-01, 8-02, 8-03, 8PJ	Primary Key 	73	C	43	46.24	0.185	C	46.24	B	29.03	A	15.05	D	8.6		3	13	Sociales	El manual de convivencia es	Un libro de cuentos	Un conjunto de normas	Un reglamento deportivo	Un horario
8	EVALUÁNDONOS 8 FINAL 2025	8-01, 8-02, 8-03, 8PJ	Primary Key 	74	C	49	52.69	0.18	C	52.69	A	32.26	D	8.6	B	6.45		3	14	Sociales	Sirve para:	Castigar	Regular la convivencia	Evitar estudiar	Eliminar reglas
8	EVALUÁNDONOS 8 FINAL 2025	8-01, 8-02, 8-03, 8PJ	Primary Key 	75	B	32	34.41	0.046	C	36.56	B	34.41	A	18.28	D	9.68		3	15	Sociales	Aplica a:	Solo estudiantes	Solo profesores	Toda la comunidad educativa	Solo directivos
8	EVALUÁNDONOS 8 FINAL 2025	8-01, 8-02, 8-03, 8PJ	Primary Key 	76	B	36	38.71	0.47	B	38.71	D	36.56	A	12.9	C	11.83		3	16	Sociales	 Promueve valores como:	 Violencia	Respeto	  Desorden	Irresponsabilidad
8	EVALUÁNDONOS 8 FINAL 2025	8-01, 8-02, 8-03, 8PJ	Primary Key 	77	B	75	80.65	0.064	B	80.65	C	9.68	A	5.38	D	4.3		3	17	Sociales	Incluye	Solo castigos	Derechos y deberes	 Solo normas académicas	 Solo premios
8	EVALUÁNDONOS 8 FINAL 2025	8-01, 8-02, 8-03, 8PJ	Primary Key 	78	D	38	40.86	0.331	D	40.86	B	29.03	C	16.13	A	12.9		3	18	Sociales	Si no se cumple:	No pasa nada	Hay sanciones formativas	Se expulsa automáticamente	Se cierra la institución
8	EVALUÁNDONOS 8 FINAL 2025	8-01, 8-02, 8-03, 8PJ	Primary Key 	79	B	69	74.19	0.316	B	74.19	C	15.05	A	5.38	D	5.38		3	19	Sociales	Se aplica en:	Casas	Hospitales	Instituciones educativas	Empresas
8	EVALUÁNDONOS 8 FINAL 2025	8-01, 8-02, 8-03, 8PJ	Primary Key 	80	A	19	20.43	-0.044	C	44.09	B	26.88	A	20.43	D	8.6		3	20	Sociales	Su objetivo principal es:	Generar conflictos	Fomentar convivencia pacífica	Eliminar normas	Evitar participación 
8	EVALUÁNDONOS 8 FINAL 2025	8-01, 8-02, 8-03, 8PJ	Primary Key 	81	B	72	77.42	0.244	B	77.42		10.75	C	4.3	A	4.3		4	11	Sociales	La rama judicial se encarga de:	Hacer leyes	Aplicar justicia	Gobernar	Educar
8	EVALUÁNDONOS 8 FINAL 2025	8-01, 8-02, 8-03, 8PJ	Primary Key 	82	B	71	76.34	0.096	B	76.34	D	15.05	C	5.38	A	2.15		4	12	Sociales	El Congreso pertenece a la rama:	Judicial	Ejecutiva	Legislativa	Militar
8	EVALUÁNDONOS 8 FINAL 2025	8-01, 8-02, 8-03, 8PJ	Primary Key 	83	C	72	77.42	0.324	C	77.42	B	11.83	D	7.53	A	2.15		4	13	Sociales	El presidente pertenece a la rama:	 Judicial	Ejecutiva	Legislativa	Electoral
8	EVALUÁNDONOS 8 FINAL 2025	8-01, 8-02, 8-03, 8PJ	Primary Key 	84	B	72	77.42	0.235	B	77.42	C	10.75	D	8.6	A	2.15		4	14	Sociales	Los jueces hacen parte de la rama:	 Ejecutiva	Legislativa	Judicial	Escolar
8	EVALUÁNDONOS 8 FINAL 2025	8-01, 8-02, 8-03, 8PJ	Primary Key 	85	A	11	11.83	-0.134	B	69.89	D	15.05	A	11.83	C	2.15		4	15	Sociales	La Constitución es:	 Un cuento	La ley más importante del país	Un reglamento escolar	Un decreto
8	EVALUÁNDONOS 8 FINAL 2025	8-01, 8-02, 8-03, 8PJ	Primary Key 	86	A	69	74.19	0.443	A	74.19	B	11.83	C	7.53	D	5.38		4	16	Sociales	La Constitución de Colombia actual fue creada en:	1810	1886	1991	2000
8	EVALUÁNDONOS 8 FINAL 2025	8-01, 8-02, 8-03, 8PJ	Primary Key 	87	B	66	70.97	0.348	B	70.97	A	10.75	D	9.68	C	7.53		4	17	Sociales	La Constitución garantiza:	 Solo deberes	Derechos y deberes	Solo castigos	Solo leyes económicas
8	EVALUÁNDONOS 8 FINAL 2025	8-01, 8-02, 8-03, 8PJ	Primary Key 	88	B	59	63.44	0.268	B	63.44	D	13.98	C	11.83	A	9.68		4	18	Sociales	Un derecho fundamental es:	 No estudiar	La vida	La guerra	El castigo
8	EVALUÁNDONOS 8 FINAL 2025	8-01, 8-02, 8-03, 8PJ	Primary Key 	89	A	56	60.22	0.524	A	60.22	B	24.73	C	7.53	D	6.45		4	19	Sociales	La Constitución protege:	 Solo al gobierno	A todos los ciudadanos	Solo a ricos	Solo a extranjeros
8	EVALUÁNDONOS 8 FINAL 2025	8-01, 8-02, 8-03, 8PJ	Primary Key 	90	D	44	47.31	0.423	D	47.31	C	23.66	B	17.2	A	10.75		4	20	Sociales	Colombia es un Estado:	 Dictatorial	Social de derecho	Monárquico	Militar
8	EVALUÁNDONOS 8 FINAL 2025	8-01, 8-02, 8-03, 8PJ	Primary Key 	91	A	50	53.76	0.295	A	53.76	C	24.73	D	11.83	B	7.53		5	31	Sociales	Colombia se encuentra cerca de la línea:	 Trópico de Capricornio	 Ecuador (línea ecuatorial)	 Círculo Polar Ártico	 Meridiano de Greenwich
8	EVALUÁNDONOS 8 FINAL 2025	8-01, 8-02, 8-03, 8PJ	Primary Key 	92	D	27	29.03	0.117	D	29.03	C	24.73	B	23.66	A	20.43		5	32	Sociales	La posición astronómica se determina mediante:	 Ríos y montañas	 Latitud y longitud	 Clima y vegetación	 Cultura y población
8	EVALUÁNDONOS 8 FINAL 2025	8-01, 8-02, 8-03, 8PJ	Primary Key 	93	C	48	51.61	0.285	C	51.61	D	20.43	A	16.13	B	10.75		5	33	Sociales	Colombia se ubica en los hemisferios:	 Norte y Occidental	 Sur y Oriental	 Norte y Oriental	 Sur y Occidental
8	EVALUÁNDONOS 8 FINAL 2025	8-01, 8-02, 8-03, 8PJ	Primary Key 	94	D	61	65.59	0.34	D	65.59	C	12.9	A	10.75	B	9.68		5	34	Sociales	Gracias a su ubicación, Colombia tiene un clima:	 Polar	 Estacional marcado	 Tropical	 Desértico extremo
8	EVALUÁNDONOS 8 FINAL 2025	8-01, 8-02, 8-03, 8PJ	Primary Key 	95	D	31	33.33	0.439	A	36.56	D	33.33	B	19.35	C	9.68		5	35	Sociales	La latitud de Colombia está cercana a:	 90° norte	 0° (Ecuador)	 180°	 60° sur
8	EVALUÁNDONOS 8 FINAL 2025	8-01, 8-02, 8-03, 8PJ	Primary Key 	96	D	58	62.37	0.378	D	62.37	B	18.28	C	16.13	A	2.15		5	36	Sociales	¿Cómo se divide políticamente Colombia?	 Provincias	 Estados	 Departamentos	 Cantone
8	EVALUÁNDONOS 8 FINAL 2025	8-01, 8-02, 8-03, 8PJ	Primary Key 	97	D	60	64.52	0.355	D	64.52	A	15.05	B	10.75	C	7.53		5	37	Sociales	¿Cuántos departamentos tiene Colombia?	20	25	32	35
8	EVALUÁNDONOS 8 FINAL 2025	8-01, 8-02, 8-03, 8PJ	Primary Key 	98	B	51	54.84	0.223	B	54.84	C	16.13	D	13.98	A	11.83		5	38	Sociales	¿Cuál es la capital de Colombia?	 Medellín	 Cali	 Cartagena	 Bogotá
8	EVALUÁNDONOS 8 FINAL 2025	8-01, 8-02, 8-03, 8PJ	Primary Key 	99	B	33	35.48	0.176	B	35.48	A	26.88	C	24.73	D	10.75		5	39	Sociales	¿Quién es la autoridad principal de un departamento?	 Alcalde	 Gobernador	 Presidente	 Concejal
8	EVALUÁNDONOS 8 FINAL 2025	8-01, 8-02, 8-03, 8PJ	Primary Key 	100	B	18	19.35	-0.011	D	36.56	A	33.33	B	19.35	C	9.68		5	40	Sociales	¿Cuál es la división administrativa más pequeña en Colombia?	 Departamento	 Municipio	 Región	 Provincia
8	EVALUÁNDONOS 8 FINAL 2025	8-01, 8-02, 8-03, 8PJ	Primary Key 	101	C	68	73.12	0.257	C	73.12	B	17.2	A	6.45	D	2.15		5	41	Sociales	¿Cuál de los siguientes es un derecho en una democracia?	 No opinar	 Ser obligado a votar	 La libertad de expresión	 La censura de ideas 
8	EVALUÁNDONOS 8 FINAL 2025	8-01, 8-02, 8-03, 8PJ	Primary Key 	102	B	54	58.06	0.256	B	58.06	A	17.2	C	16.13	D	6.45		5	42	Sociales	Colombia limita al norte con:	 Perú	 Ecuador	 Mar Caribe	 Brasil
8	EVALUÁNDONOS 8 FINAL 2025	8-01, 8-02, 8-03, 8PJ	Primary Key 	103	D	58	62.37	0.271	D	62.37	C	12.9	B	11.83	A	11.83		5	43	Sociales	¿Cuál de estos países limita con Colombia al sur?	 Panamá	 Perú	 Venezuela	 Nicaragua
8	EVALUÁNDONOS 8 FINAL 2025	8-01, 8-02, 8-03, 8PJ	Primary Key 	104	A	56	60.22	0.315	A	60.22	C	18.28	B	15.05	D	4.3		5	44	Sociales	Colombia limita al oriente con:	 Ecuador y Perú	 Venezuela y Brasil	 Panamá	 Chile
8	EVALUÁNDONOS 8 FINAL 2025	8-01, 8-02, 8-03, 8PJ	Primary Key 	105	B	9	9.68	0.106	A	49.46	C	31.18	B	9.68	D	8.6		5	45	Sociales	¿Qué país limita con Colombia al noroccidente?	 Ecuador	 Brasil	 Panamá	 Perú
8	EVALUÁNDONOS 8 FINAL 2025	8-01, 8-02, 8-03, 8PJ	Primary Key 	106	D	35	37.63	0.173	D	37.63	A	32.26	B	18.28	C	10.75		5	46	Sociales	¿Cuál de los siguientes NO es límite de Colombia?	 Venezuela	 Brasil	 Bolivia	 Perú
8	EVALUÁNDONOS 8 FINAL 2025	8-01, 8-02, 8-03, 8PJ	Primary Key 	107	A	48	51.61	0.177	A	51.61	C	24.73	D	15.05	B	6.45		5	47	Sociales	Colombia está ubicada en el continente:	 Europa	 Asia	 América	 África
8	EVALUÁNDONOS 8 FINAL 2025	8-01, 8-02, 8-03, 8PJ	Primary Key 	108	B	30	32.26	-0.043	B	32.26	A	27.96	D	20.43	C	17.2		5	48	Sociales	Colombia se encuentra en América:	 Del Norte	 Central	 Del Sur	 Europa Oriental
8	EVALUÁNDONOS 8 FINAL 2025	8-01, 8-02, 8-03, 8PJ	Primary Key 	109	C	18	19.35	0.129	A	34.41	D	24.73	B	20.43	C	19.35		5	49	Sociales	Colombia tiene costas en:	 Un solo océano	 Océano Atlántico y Pacífico	 Solo el océano Índico	 Ningún océano
8	EVALUÁNDONOS 8 FINAL 2025	8-01, 8-02, 8-03, 8PJ	Primary Key 	110	D	45	48.39	0.485	D	48.39	B	24.73	C	17.2	A	8.6		5	50	Sociales	El océano Pacífico se encuentra al:	 Norte	 Oriente	 Occidente	 Sur
8	EVALUÁNDONOS 8 FINAL 2025	8-01, 8-02, 8-03, 8PJ	Primary Key 	111	B	49	52.69	0.514	B	52.69	D	19.35	A	15.05	C	10.75		Grado	Pregunta	Asignatura	Texto de la pregunta	Opción A	Opción B	Opción C	Opción D
8	EVALUÁNDONOS 8 FINAL 2025	8-01, 8-02, 8-03, 8PJ	Primary Key 	112	C	36	38.71	0.445	C	38.71	B	23.66	D	20.43	A	13.98		3	21	Lenguaje	El texto anterior corresponde a:	Un cuento, porque narra una historia que puede ser real o imaginaria.	Una leyenda, porque cuenta sobre las costumbres y tradiciones de los pueblos.	Una fábula, porque la narración deja una enseñanza o moraleja.	Un mito, porque cuenta sobre el origen o creación de algo o de alguien.
8	EVALUÁNDONOS 8 FINAL 2025	8-01, 8-02, 8-03, 8PJ	Primary Key 	113	D	40	43.01	0.356	D	43.01	C	23.66	A	22.58	B	8.6		3	22	Lenguaje	¿Por qué el león se echó a reír cuando el ratón le habló?	Porque pensó que el ratón era gracioso.	Porque no creía que el ratón pudiera ayudarlo.	Porque tenía hambre y quería comerlo.	Porque le gustaba escuchar historias.
8	EVALUÁNDONOS 8 FINAL 2025	8-01, 8-02, 8-03, 8PJ	Primary Key 	114	C	42	45.16	0.246	C	45.16	A	24.73	B	18.28	D	8.6		3	23	Lenguaje	¿Cómo ayudó el ratón al león más tarde?	Le trajo comida.	Rompió una red con sus dientes.	Le enseñó a cazar.	Le dio un consejo.
8	EVALUÁNDONOS 8 FINAL 2025	8-01, 8-02, 8-03, 8PJ	Primary Key 	115	D	66	70.97	0.521	D	70.97	A	10.75	C	9.68	B	6.45		3	24	Lenguaje	¿Qué lugar visitó Ana para aprender sobre ciencia y tecnología?	El Jardín Botánico	El Museo de Arte 	El Zoológico 	El Parque Explora 
8	EVALUÁNDONOS 8 FINAL 2025	8-01, 8-02, 8-03, 8PJ	Primary Key 	116	C	49	52.69	0.332	C	52.69	D	23.66	A	10.75	B	10.75		3	25	Lenguaje	Las palabras que están resaltadas con negrita (Ana, Carlos, Medellín, …) son:	Sustantivos propios, porque nombran personas y lugares en particular.	Sustantivos comunes, porque nombran personas y lugares en general.	Adjetivos, porque describe a las personas y lugares.	Verbos, porque describe las acciones de las personas y lugares.
8	EVALUÁNDONOS 8 FINAL 2025	8-01, 8-02, 8-03, 8PJ	Primary Key 	117	B	68	73.12	0.46	B	73.12	A	9.68	C	7.53	D	7.53		3	26	Lenguaje	Las palabras que están subrayadas en el texto (pequeña, emocionada, altos, …) son:  	Sustantivos contables, porque se pueden contar.	Adjetivos calificativos, porque describe a las personas y lugares.	Verbos, porque describe las acciones de las personas y lugares.	Sustantivos propios, porque nombran personas y lugares en particular.
8	EVALUÁNDONOS 8 FINAL 2025	8-01, 8-02, 8-03, 8PJ	Primary Key 	118	C	61	65.59	0.498	C	65.59	A	16.13	B	10.75	D	5.38		3	27	Lenguaje	La anterior imagen es:	Una señal de tránsito.	Un volante publicitario.	Una factura de venta.	Un recibo de internet.
8	EVALUÁNDONOS 8 FINAL 2025	8-01, 8-02, 8-03, 8PJ	Primary Key 	119	D	42	45.16	0.276	D	45.16	B	22.58	C	19.35	A	10.75		3	28	Lenguaje	La intención del texto anterior es:	Ofrecer clases de repostería.	Convencer de que comas galletas.	Buscar empleados para una panadería.	Enseñar a cocinar.
8	EVALUÁNDONOS 8 FINAL 2025	8-01, 8-02, 8-03, 8PJ	Primary Key 	120	A	37	39.78	0.39	A	39.78	D	20.43	B	19.35	C	17.2		3	29	Lenguaje	Según el texto ¿Por qué las jirafas no tienen que pelearse con otros animales por comida?	Porque son muy rápidas y pueden escapar fácilmente.	Porque son las únicas que llegan tan alto para comer hojas de los árboles.	Porque son amigables con otros animales.	Porque no les gusta la comida de los demás.
9	EVALUÁNDONOS 9 FINAL 2025	9-01, 9-02, 9-03, 9PJ	Primary Key 	1	A	31	37.8	0.214	A	37.8	C	30.49	D	18.29	B	13.41		3	30	Lenguaje	¿Cuántas vértebras tiene el cuello de una jirafa, a pesar de su longitud?	Más que las de una persona.	Menos que las de una persona.	El mismo número que las de una persona.	No tiene vértebras en el cuello.
9	EVALUÁNDONOS 9 FINAL 2025	9-01, 9-02, 9-03, 9PJ	Primary Key 	2	B	55	67.07	0.194	B	67.07	A	13.41	C	12.2	D	7.32		4	21	Lenguaje	¿Por qué Mateo estaba emocionado?	Porque iba a jugar con sus amigos en el parque.	Porque tenía un examen en la escuela.	Porque era la final del torneo de fútbol.	Porque iba a ver una película.
9	EVALUÁNDONOS 9 FINAL 2025	9-01, 9-02, 9-03, 9PJ	Primary Key 	3	B	53	64.63	-0.04	B	64.63	C	25.61	D	6.1	A	3.66		4	22	Lenguaje	Las oraciones ¡Hoy era el gran partido de la final del torneo de fútbol de su escuela!   Y ¡Den lo mejor de ustedes en la cancha y diviértanse! Son: 	Enunciativas, porque está contando algo que pasó.	Interrogativas, porque están haciendo una pregunta.	Exclamativas, porque están expresando algo con emoción.	Imperativas, porque están dando órdenes.
9	EVALUÁNDONOS 9 FINAL 2025	9-01, 9-02, 9-03, 9PJ	Primary Key 	4	C	56	68.29	-0.009	C	68.29	D	20.73	A	8.54	B	2.44		4	23	Lenguaje	La oración ¿Estarían listos para jugar su mejor partido? Es: 	Exclamativas, porque están expresando algo con emoción.	Imperativas, porque está dando una orden.	Enunciativas, porque está contando algo que pasó.	Interrogativas, porque están haciendo una pregunta.
9	EVALUÁNDONOS 9 FINAL 2025	9-01, 9-02, 9-03, 9PJ	Primary Key 	5	D	23	28.05	0.453	D	28.05	A	25.61	C	25.61	B	20.73		4	24	Lenguaje	El texto anterior corresponde a:	Un cuento, porque narra una historia que puede ser real o imaginaria.	Una fábula, porque la narración deja una enseñanza o moraleja. 	Una leyenda, porque cuenta sobre las costumbres y tradiciones de los pueblos.	Un mito, porque cuenta sobre el origen o creación de algo o de alguien.
9	EVALUÁNDONOS 9 FINAL 2025	9-01, 9-02, 9-03, 9PJ	Primary Key 	6	B	60	73.17	0.33	B	73.17	D	10.98	A	8.54	C	7.32		4	25	Lenguaje	El narrador de la anterior historia es:	Omnisciente, porque es como un dios que sabe todo lo que ocurrió.	El papá, porque cuenta cómo abandonó a sus hijos.	Hansel, porque cuenta la historia que le pasó a él y a su hermana.	La bruja, porque cuenta cómo engañó a los niños.
9	EVALUÁNDONOS 9 FINAL 2025	9-01, 9-02, 9-03, 9PJ	Primary Key 	7	C	17	20.73	0.074	A	52.44	C	20.73	B	17.07	D	9.76		4	26	Lenguaje	Cuál de las siguientes opciones resume correctamente lo que ocurrió en el inicio, nudo y desenlace de la historia:	Inicio: Hansel y Gretel viven con siete enanitos que los cuidan en el bosque. Nudo: Una bruja disfrazada de anciana les da una manzana envenenada y Hansel cae dormido. Desenlace: Un príncipe llega, despierta a Hansel y todos celebran en un castillo.	Inicio: Hansel cuenta cómo él y su hermana Gretel son abandonados en el bosque por su madrastra, pero logra regresar la primera vez usando piedras. Nudo: En el segundo abandono, no pueden volver porque los pájaros comen las migas de pan, y terminan atrapados por una bruja que quiere comerse a Hansel. Desenlace: Gretel logra engañar a la bruja y vencerla, luego ambos regresan a casa con riquezas y se reencuentran con su padre.	Inicio: El padre de Hansel y Gretel los lleva al bosque para enseñarles a cazar. Nudo: Se pierden y son rescatados por un lobo que los protege de una bruja. Desenlace: El lobo los guía de regreso a casa y se convierte en su mascota.	Inicio: Hansel decide irse de casa porque quiere explorar el bosque y encontrar tesoros. Nudo: Encuentra una casa de dulces, pero la bruja es amable y les enseña a cocinar postres. Desenlace: Hansel y Gretel se quedan a vivir con la bruja y abren una pastelería juntos.
9	EVALUÁNDONOS 9 FINAL 2025	9-01, 9-02, 9-03, 9PJ	Primary Key 	8	B	66	80.49	0.235	B	80.49	A	17.07	C	1.22	D	1.22		4	27	Lenguaje	El texto anterior corresponde a:	Un cuento, porque narra una historia que puede ser real o imaginaria.	Una fábula, porque la narración deja una enseñanza o moraleja. 	Una leyenda, porque cuenta sobre las costumbres y tradiciones de los pueblos.	Un mito, porque cuenta sobre el origen o creación de algo o de alguien.
9	EVALUÁNDONOS 9 FINAL 2025	9-01, 9-02, 9-03, 9PJ	Primary Key 	9	C	63	76.83	0.208	C	76.83	B	14.63	D	6.1	AC	1.22		4	28	Lenguaje	Otra posible moraleja de la anterior historia puede ser:	Más vale ser astuto que fuerte.	No humilles a los demás. 	Trabaja fuerte para conseguir las cosas y luego disfrutar.	Cuando engañas alguien, tarde o temprano serás descubierto.
9	EVALUÁNDONOS 9 FINAL 2025	9-01, 9-02, 9-03, 9PJ	Primary Key 	10	C	28	34.15	0.392	C	34.15	D	26.83	B	21.95	A	17.07		4	29	Lenguaje	Según el texto, ¿Cuáles son los lugares donde deambula La Patasola?	En la casa de su patrón. 	En las calles de Popayán.	En fincas, bosques, selvas solitarias, sierras, cañadas y caminos.	Solamente en bosques donde hay hombres.
9	EVALUÁNDONOS 9 FINAL 2025	9-01, 9-02, 9-03, 9PJ	Primary Key 	11	B	19	23.17	0.027	C	32.93	A	24.39	B	23.17	D	19.51		4	30	Lenguaje	¿Cómo cambia la apariencia de La Patasola según la leyenda?	De una anciana se convierte en una niña.	De una mujer hermosa pasa a ser una figura horrible con ojos de fuego. 	De un espíritu pasa a ser una mariposa.	De un fantasma se convierte en animal salvaje.
9	EVALUÁNDONOS 9 FINAL 2025	9-01, 9-02, 9-03, 9PJ	Primary Key 	12	D	37	45.12	0.282	D	45.12	A	24.39	B	20.73	C	9.76		5	41	Lenguaje	¿Quién es el emisor del mensaje?	La paciente, porque escucha la información	El médico, porque transmite la información	El hospital, porque es el lugar donde ocurre la conversación	El estetoscopio, porque es un objeto médico
9	EVALUÁNDONOS 9 FINAL 2025	9-01, 9-02, 9-03, 9PJ	Primary Key 	13	C	40	48.78	0.288	C	48.78	B	34.15	D	10.98	A	6.1		5	42	Lenguaje	Observa la interacción entre el médico y la paciente. ¿Cuál es el canal principal que están utilizando para comunicarse?	El canal visual, porque se miran entre sí	El canal escrito, papel, porque le entrega una orden médica	El canal oral, la voz, porque el mensaje se transmite hablando	El canal digital, celular, porque le envía un mensaje
9	EVALUÁNDONOS 9 FINAL 2025	9-01, 9-02, 9-03, 9PJ	Primary Key 	14	C	29	35.37	0.089	C	35.37	D	26.83	A	18.29	B	17.07		5	43	Lenguaje	Teniendo en cuenta la situación, ¿por qué es importante que el médico use un lenguaje claro al decir “La cirugía será la próxima semana”?	Porque así el hospital cumple con sus normas internas	Porque permite que la paciente comprenda el mensaje correctamente y tome decisiones	Porque el médico debe hablar mucho en todas las consultas	Porque el mensaje solo importa si se repite varias veces
9	EVALUÁNDONOS 9 FINAL 2025	9-01, 9-02, 9-03, 9PJ	Primary Key 	15	C	33	40.24	0.17	C	40.24	A	29.27	B	28.05	D	2.44		5	44	Lenguaje	El texto anterior corresponde a:	Un cuento, porque narra una historia que puede ser real o imaginaria.	Una fábula, porque la narración deja una enseñanza o moraleja. 	Una leyenda, porque cuenta sobre las costumbres y tradiciones de los pueblos.	Un mito, porque cuenta sobre el origen o creación de algo o de alguien.
9	EVALUÁNDONOS 9 FINAL 2025	9-01, 9-02, 9-03, 9PJ	Primary Key 	16	C	62	75.61	0.385	C	75.61	B	13.41	D	7.32	A	3.66		5	45	Lenguaje	Otra posible moraleja de la anterior historia puede ser:	Más vale ser astuto que fuerte.	No humilles a los demás. 	Trabaja fuerte para conseguir las cosas y luego disfrutar.	Cuando engañas alguien, tarde o temprano serás descubierto.
9	EVALUÁNDONOS 9 FINAL 2025	9-01, 9-02, 9-03, 9PJ	Primary Key 	17	C	26	31.71	0.253	A	51.22	C	31.71	B	12.2	D	4.88		5	46	Lenguaje	¿Cuál de las siguientes imágenes corresponde la descripción que hace el texto de la Madremonte?				
9	EVALUÁNDONOS 9 FINAL 2025	9-01, 9-02, 9-03, 9PJ	Primary Key 	18	D	15	18.29	0.114	B	31.71	A	28.05	C	21.95	D	18.29		5	47	Lenguaje	¿Cuál de las siguientes afirmaciones es INCORRECTA?	Las leyendas son relatos transmitidos oralmente de generación en generación.	Las leyendas dejan moraleja al final, por ejemplo, no dañar la naturaleza.  	Las leyendas son relatos tradicionales que mezclan hechos reales con elementos fantásticos o sobrenaturales. 	Las leyendas se caracterizan por situarse en lugares y tiempos específicos, tener un tono misterioso, y buscar explicar fenómenos naturales o costumbres locales con un toque de magia.
9	EVALUÁNDONOS 9 FINAL 2025	9-01, 9-02, 9-03, 9PJ	Primary Key 	19	D	32	39.02	-0.122	D	39.02	A	21.95	B	20.73	C	18.29		5	48	Lenguaje	El propósito del texto anterior es:	Narrar cómo se crearon todas las cosas de la Tierra.	Contar cómo vivían los Mayas.	Narrar el origen del colibrí.	Explicar qué son los buenos y los malos deseos.
9	EVALUÁNDONOS 9 FINAL 2025	9-01, 9-02, 9-03, 9PJ	Primary Key 	20	B	76	92.68	0.333	B	92.68	A	4.88	D	2.44				5	49	Lenguaje	En la narración se dice que, quienes crearon al colibrí fueron:	Los hombres.	Los dioses.	Las flores.	Los animales.
9	EVALUÁNDONOS 9 FINAL 2025	9-01, 9-02, 9-03, 9PJ	Primary Key 	21	B	35	42.68	0.203	B	42.68	A	31.71	D	14.63	C	9.76		5	50	Lenguaje	Según el texto, cuando un colibrí vuela alrededor de tu cabeza, no debes tocarlo, porque:	Está buscando comida en tu cabello.	Está tomando tu deseo para llevarlo a otros.	Está haciendo un nido en tu pelo.	Está examinando tu cerebro.
