5	EVALUÁNDONOS 5 FINAL 2025	5-01, 5PJ, 5PU, 5S, 5Y	Primary Key 	37	D	34	47.22	0.201	D	47.22	C	22.22	B	15.28	A	13.89		8	Si a un recipiente que contiene 100 ml de agua se le adiciona una piedra irregular y se observa que el nivel del agua aumenta 5 ml, podemos afirmar que:	Ciencias		La masa de la piedra cambia.	El volumen del agua es de 105 ml.	La forma de la piedra cambia.	El volumen de la piedra es de 5 ml.
5	EVALUÁNDONOS 5 FINAL 2025	5-01, 5PJ, 5PU, 5S, 5Y	Primary Key 	38	C	52	72.22	0.472	C	72.22	B	12.5	D	8.33	A	5.56		8	Se te ha solicitado organizar los materiales en orden descendente o decreciente de sus densidades, el orden correcto corresponde a:	Ciencias	Se presentan los siguientes materiales con su respectiva densidad: aluminio: 2.7 g/cm³, agua: 1.0 g/cm³ , cobre: 8.9 g/cm³ y madera: 0.6 g/cm³.	aluminio, agua, cobre y madera.	madera, cobre, agua, aluminio.	cobre, aluminio, agua y madera.	madera, agua, aluminio, cobre.
5	EVALUÁNDONOS 5 FINAL 2025	5-01, 5PJ, 5PU, 5S, 5Y	Primary Key 	39	A	58	80.56	0.307	A	80.56	B	12.5	C	4.17	D	2.78		8	La diferencia de densidades entre el agua sólida y líquida se debe a que en el proceso de congelación del agua:	Ciencias	La densidad de una sustancia es la relación entre la masa que tiene y el volumen que ocupa, para hallar la densidad se usa la fórmula matemática D=m/v. La densidad de 10 gramos de agua (H2O) es de 1 g/ml a 4 grados centígrados (°C). Al disminuir la temperatura hasta congelarla (hielo), su densidad disminuye a 0.9 g/ml.	Disminuye el volumen sin variar la masa.	Aumenta el volumen sin variar la masa.	Aumenta la masa y el volumen.	Disminuye la masa y el volumen.
5	EVALUÁNDONOS 5 FINAL 2025	5-01, 5PJ, 5PU, 5S, 5Y	Primary Key 	40	D	52	72.22	0.4	D	72.22	C	12.5	A	11.11	B	4.17		8	La densidad de una sustancia desconocida cuya masa es 100 gramos (g) y que ocupa un volumen de 20 mililitros (ml) corresponde a:	Ciencias		100 g/ml	20 ml/g	5g/ml	500 ml/g
5	EVALUÁNDONOS 5 FINAL 2025	5-01, 5PJ, 5PU, 5S, 5Y	Primary Key 	41	A	31	43.06	0.362	C	44.44	A	43.06	B	8.33	D	4.17		8	Al dejar caer la esfera en la probeta como se muestra en la siguiente figura y teniendo en cuenta las densidades de la tabla, lo más probable es que:	Ciencias		Flote sobre la superficie de Q por ser esférica.	Quede en el fondo, por ser un sólido.	Flote sobre P por tener menos volumen.	Quede suspendida sobre R por su densidad.
5	EVALUÁNDONOS 5 FINAL 2025	5-01, 5PJ, 5PU, 5S, 5Y	Primary Key 	42	C	48	66.67	0.431	C	66.67	D	16.67	B	9.72	A	6.94		8	Si el estudiante los arroja a un recipiente con agua (la densidad del agua es=1g/ml), ¿cuál de los cubos tiene mayor probabilidad de hundirse más rápido o ser el más denso?	Ciencias	Un estudiante tiene cuatro cubos de diferentes materiales pero del mismo tamaño (volumen). Al pesarlos, obtiene los siguientes resultados:	El cubo 2, porque tiene la mayor masa en el mismo volumen.	Todos se hunden por igual porque tienen el mismo tamaño.	El cubo 1, porque su masa es equilibrada.	El cubo 3, porque es el más ligero.
5	EVALUÁNDONOS 5 FINAL 2025	5-01, 5PJ, 5PU, 5S, 5Y	Primary Key 	43	C	68	94.44	0.399	C	94.44	B	4.17	D	1.39				8	En este contexto, ¿cuál de las siguientes preguntas de investigación puede contestarse según las Ciencias Naturales?	Ciencias	Pedro vive al lado de una zona industrial cerca de un río. Durante siglos, este río ha sido importante para la comunidad que vive ahí y para los animales, pero últimamente se le ha permitido a las industrias arrojar sus desechos al río, lo que genera una alta contaminación. Pedro está preocupado y quiere realizar una investigación.	¿Cómo afecta la contaminación en el río a los animales y plantas que allí habitan?	¿Cuáles son las políticas que debe aplicar el gobierno local para disminuir la contaminación?	¿Cuáles son los productos industriales más consumidos por los habitantes de la zona?	¿Cómo mejorar la productividad de las industrias para que aumenten sus ganancias?
5	EVALUÁNDONOS 5 FINAL 2025	5-01, 5PJ, 5PU, 5S, 5Y	Primary Key 	44	C	64	88.89	0.302	C	88.89	B	6.94	D	4.17				8	 ¿Por qué el experimento realizado no le permite comprobar su idea?	Ciencias	Laura tiene la idea de que la densidad del agua y la densidad de una mezcla de agua y sal es la misma. Para comprobarla realiza el siguiente experimento: toma tres recipientes y en cada uno agrega 100 mL de agua, una esfera de hierro y diferentes cantidades de sal, como se muestra a continuación. Laura observa que la esfera no flota en ninguno de los recipientes y concluye que la densidad del líquido en los recipientes es igual, pero su profesor le indica que con este experimento no se puede comprobar su idea.	Porque todas las esferas son de material diferente.	Porque debe cambiar la densidad de las esferas en cada recipiente.	Porque utiliza esferas de igual volumen en los tres recipientes.	Porque la densidad de las esferas es mayor que la de los líquidos en los recipientes.
5	EVALUÁNDONOS 5 FINAL 2025	5-01, 5PJ, 5PU, 5S, 5Y	Primary Key 	45	B	65	90.28	0.375	B	90.28	A	4.17	C	4.17	D	1.39		8	Si un átomo neutro de Sodio tiene Z=11, ¿cuál de las siguientes afirmaciones describe correctamente su composición?	Ciencias		Tiene 11 neutrones en su núcleo para ser estable.	Tiene 11 niveles de energía.	Tiene 11 protones en su núcleo y 11 electrones girando alrededor.	Tiene un total de 11 partículas en todo el átomo.
5	EVALUÁNDONOS 5 FINAL 2025	5-01, 5PJ, 5PU, 5S, 5Y	Primary Key 	46	D	57	79.17	0.451	D	79.17	B	8.33	C	6.94	A	4.17		8	Un átomo tiene 15 protones, 16 neutrones y 15 electrones ¿Cuál es su número atómico (Z) y su número de masa (A)?	Ciencias		Z=15, A=16	Z=31, A=15	Z=30, A=31	Z=15, A=31
5	EVALUÁNDONOS 5 FINAL 2025	5-01, 5PJ, 5PU, 5S, 5Y	Primary Key 	47	A	57	79.17	0.3	A	79.17	B	11.11	D	5.56	C	4.17		8	diga cuál es el volumen que ocupa la piedra 	Ciencias 	El volumen se define como el espacio que ocupa un cuerpo y este se puede medir en mililitros (ml) o litros (l). De acuerdo a la siguiente imagen	30 ml	230 ml	380 ml	80 ml
5	EVALUÁNDONOS 5 FINAL 2025	5-01, 5PJ, 5PU, 5S, 5Y	Primary Key 	48	C	36	50	0.155	C	50	B	36.11	D	8.33	A	4.17		8	¿Qué tipo de energía se convierte en una hidroeléctrica?	Ciencias 	En una central hidroeléctrica el agua de uno o varios arroyos se acumula en un embalse, natural o artificial (creado por una presa), y luego fluye río abajo para accionar las turbinas y, finalmente, volver al río. Cuando las turbinas hidráulicas se activan se produce energía eléctrica, tal como se muestra en la siguiente figura. 	De energía mareomotriz a eléctrica	De energía geotérmica a eléctrica	De energía cinética a eléctrica 	De energía potencial a eléctrica
5	EVALUÁNDONOS 5 FINAL 2025	5-01, 5PJ, 5PU, 5S, 5Y	Primary Key 	49	B	58	80.56	0.34	B	80.56	A	8.33	C	5.56	D	4.17		8	De acuerdo con la información anterior, se puede afirmar que la distancia que recorrerán las cajas de la Figura 2, comparada con la distancia que recorre la caja en la Figura 1, será	Ciencias 	La Figura 1 muestra una persona empujando una nevera empacada en su caja, con una fuerza F1; después de que la persona impulsa la nevera empacada en su caja, esta se mueve una distancia de 2 metros. En la Figura 2, se ve a la misma persona empujando la caja con la nevera y una caja con un horno, una sobre la otra, con la misma fuerza F1 que ejerció para mover la caja de la Figura 1, y durante el mismo tiempo.	mayor, porque al tener que empujar dos cajas la persona tendrá que hacer un esfuerzo menor, ya que las dos cajas representan un aumento del peso.	menor, porque la persona, para alcanzar los mismos 2 metros de distancia, necesita aplicar más tiempo la fuerza, ya que tiene que empujar mayor peso.	igual, porque la persona que aplica la fuerza a las dos cajas es la misma que aplicó la fuerza a la caja que se encontraba sola.	mayor, porque al colocar otra caja encima de la primera, el peso de ambas se reparte; de este modo, las dos cajas avanzan una distancia superior a 2 metros.
5	EVALUÁNDONOS 5 FINAL 2025	5-01, 5PJ, 5PU, 5S, 5Y	Primary Key 	50	B	58	80.56	0.209	B	80.56	C	12.5	A	5.56		1.39		8	¿cuál de las siguientes opciones representa una variable dependiente en el experimento?*  	Ciencias 	Un grupo de estudiantes de octavo grado está realizando un experimento para determinar cómo la longitud de un péndulo afecta su período de oscilación. Siguiendo el método científico	La masa del péndulo  	La longitud del péndulo  	El período de oscilación del péndulo  	El material del péndulo  
5	EVALUÁNDONOS 5 FINAL 2025	5-01, 5PJ, 5PU, 5S, 5Y	Primary Key 	51	C	52	72.22	0.088	C	72.22	B	16.67	A	5.56	D	5.56		9	81. 	Biologia 	Es un proceso o metodología para obtener nuevos conocimientos, que ha caracterizado históricamente a la ciencia, además consiste en la observación sistemática, medición, experimentación y la formulación, análisis, propuesta y modificación de hipótesis.  La información anterior refiere a: 	A. Método científico	B. Experimentación	C. Hipótesis 	D. Respuestas B y C son correctas 
5	EVALUÁNDONOS 5 FINAL 2025	5-01, 5PJ, 5PU, 5S, 5Y	Primary Key 	52	A	36	50	0.317	A	50	C	26.39	B	15.28	D	8.33		9	82	Biologia 	¿Cuál de las siguientes acciones NO es una estrategia adecuada para gestionar la escasez de agua?	A. Invertir en tecnologías de riego eficientes y sistemas de recolección de agua de lluvia.	B. Promover el uso de cultivos que requieran menos agua y sean más resistentes a la sequía	C. Aumentar el consumo de agua y reducir las restricciones al uso del agua. 	D. Implementar políticas de tarificación del agua que reflejen su valor real y fomenten el ahorro.
5	EVALUÁNDONOS 5 FINAL 2025	5-01, 5PJ, 5PU, 5S, 5Y	Primary Key 	53	B	64	88.89	0.222	B	88.89	D	4.17	C	4.17	A	2.78		9	83	Biologia 	   ¿este paso se le conoce con el nombre de:? 	A. Planteamiento del problema 	B. Hipótesis 	C. Experimentación	D. Respuesta A y C son correctas 
5	EVALUÁNDONOS 5 FINAL 2025	5-01, 5PJ, 5PU, 5S, 5Y	Primary Key 	54	D	41	56.94	0.333	D	56.94	C	22.22	B	12.5	A	6.94		9	84	Biologia 	¿Qué paso del método científico está realizando el científico al medir la altura de las plantas y comparar los resultados?	Formulación de hipótesis. 	Experimentación.	Comunicación de resultados.	Análisis de datos
5	EVALUÁNDONOS 5 FINAL 2025	5-01, 5PJ, 5PU, 5S, 5Y	Primary Key 	55	C	54	75	0.077	C	75	A	12.5	D	6.94	B	5.56		9	85	Biologia 	Teniendo en cuenta el tema de método científico, Cuál es el orden correcto de los pasos o fases del método científico.	A. Conclusiones, experimentación, análisis de resultados, hipótesis, problema. 	B. Observación, Planteamiento del problema, Experimentación y Conclusiones. 	C. Observación, Hipótesis, Conclusiones, Pregunta, Experimentación	D. Observación, Planteamiento del problema, Hipótesis, Experimentación, Análisis de datos y Conclusiones
5	EVALUÁNDONOS 5 FINAL 2025	5-01, 5PJ, 5PU, 5S, 5Y	Primary Key 	56	B	60	83.33	0.368	B	83.33	A	9.72	D	4.17	C	2.78		9	86	Biologia 	La información anterior corresponde a: 	A. La hipótesis 	B. Observación 	C. Experimentación	D. Planteamiento del problema 
5	EVALUÁNDONOS 5 FINAL 2025	5-01, 5PJ, 5PU, 5S, 5Y	Primary Key 	57	D	34	47.22	0.51	D	47.22	A	33.33	C	12.5	B	6.94		9	87	Biologia 	¿Cómo llamamos a este fenómeno?	A. Ciclo del agua	B. Ciclos biogeoquímicos 	C. Escorrentía	D. Lluvia ácida  
5	EVALUÁNDONOS 5 FINAL 2025	5-01, 5PJ, 5PU, 5S, 5Y	Primary Key 	58	B	34	47.22	0.052	B	47.22	C	27.78	A	22.22	D	2.78		9	88	Biologia 	 ¿La información anterior se refiere a:?	A. Deforestación	B. Erosión	C. Fertilización	D. Filtración 
5	EVALUÁNDONOS 5 FINAL 2025	5-01, 5PJ, 5PU, 5S, 5Y	Primary Key 	59	C	48	66.67	0.502	C	66.67	B	20.83	A	8.33	D	2.78		9	89	Biologia 	¿Cuál es la capa a la que se refiere el enunciado?	A. Biosfera 	B. Atmosfera	C. Capa de ozono	D. Ninguna de las respuestas es correcta
5	EVALUÁNDONOS 5 FINAL 2025	5-01, 5PJ, 5PU, 5S, 5Y	Primary Key 	60	A	13	18.06	-0.211	C	51.39	D	26.39	A	18.06	B	2.78		9	90	Biologia 	La información anterior refiere a: 	A. Contaminación atmosférica 	B. Contaminación del suelo	C. Contaminación térmica	D. Contaminación hídrica 
5	EVALUÁNDONOS 5 FINAL 2025	5-01, 5PJ, 5PU, 5S, 5Y	Primary Key 	61	A	57	79.17	0.288	A	79.17	C	13.89	D	4.17	B	2.78		9	91	Biologia 	¿La información anterior refiere a: 	A. Contaminación del suelo	B. Contaminación térmica 	C. Contaminación hídrica 	D. Contaminación atmosférica 
5	EVALUÁNDONOS 5 FINAL 2025	5-01, 5PJ, 5PU, 5S, 5Y	Primary Key 	62	B	59	81.94	0.527	B	81.94	A	11.11	C	4.17	D	2.78		9	92	Biologia 	La información anterior refiere a: 	A. Contaminación hídrica 	B. Contaminación del suelo	C. Contaminación atmosférica 	D. Contaminación térmica 
5	EVALUÁNDONOS 5 FINAL 2025	5-01, 5PJ, 5PU, 5S, 5Y	Primary Key 	63	C	69	95.83	0.256	C	95.83	D	2.78	A	1.39				9	93	Biologia 	La información anterior refiere a: 	A. Deforestación	B. Erosión 	C. Fertilización	D. Ninguna de las respuestas es correcta
5	EVALUÁNDONOS 5 FINAL 2025	5-01, 5PJ, 5PU, 5S, 5Y	Primary Key 	64	B	69	95.83	0.442	B	95.83	D	2.78		1.39				9	94	Biologia 	La información anterior refiere a: 	A. Contaminación atmosférica 	B. Contaminación del suelo	C. Contaminación térmica 	D. Contaminación hídrica 
5	EVALUÁNDONOS 5 FINAL 2025	5-01, 5PJ, 5PU, 5S, 5Y	Primary Key 	65	C	70	97.22	0.249	C	97.22	A	2.78						9	95	Biologia 	Qué sucede cuando la lluvia acida cae en la ciudad, sobre los monumentos, estatuas, automóviles y zonas verdes. 	A. Es de beneficio ya que el agua es vida.	B. Es bueno ya que ayuda a limpiar algunos elementos como automóviles y estatuas 	C. Es perjudicial por afecta a las zonas verdes y deteriora los elementos mencionados	D. Las respuestas A y C son correctas 
5	EVALUÁNDONOS 5 FINAL 2025	5-01, 5PJ, 5PU, 5S, 5Y	Primary Key 	66	C	62	86.11	0.153	C	86.11	A	8.33	B	2.78	D	2.78		9	96	Biologia 	La información anterior refiere a 	A. Medidas	B. Derivadas 	C. Magnitudes físicas 	D. Todas las respuestas son correctas 
5	EVALUÁNDONOS 5 FINAL 2025	5-01, 5PJ, 5PU, 5S, 5Y	Primary Key 	67	D	44	61.11	0.52	D	61.11	C	16.67	A	11.11	B	11.11		9	97	Biologia 	¿Cuál de las siguientes opciones NO es un ejemplo de recurso natural renovable?	A. La energía eólica	B. El carbón. 	C. La biomasa. 	D. El agua.
5	EVALUÁNDONOS 5 FINAL 2025	5-01, 5PJ, 5PU, 5S, 5Y	Primary Key 	68	A	67	93.06	0.187	A	93.06	B	4.17	D	2.78				9	98	Biologia 	¿Cuál de las siguientes acciones contribuiría a un uso más sostenible de los recursos naturales no renovables?	Aumentar la extracción de petróleo y gas natural. 	Fomentar el consumo de productos elaborados con materiales reciclados. 	Promover el uso de energías renovables como la solar y la eólica. 	Incentivar la construcción de centrales nucleares.
5	EVALUÁNDONOS 5 FINAL 2025	5-01, 5PJ, 5PU, 5S, 5Y	Primary Key 	69	A	61	84.72	0.275	A	84.72	C	8.33	D	4.17	B	2.78		9	99	Biologia 	¿Cuál de las siguientes afirmaciones sobre la energía solar es INCORRECTA?	A. Es una fuente de energía renovable. 	B. Su aprovechamiento genera residuos contaminantes. 	C. Su disponibilidad es ilimitada en todo el planeta. 	D. Puede ser utilizada para generar electricidad y calor.
5	EVALUÁNDONOS 5 FINAL 2025	5-01, 5PJ, 5PU, 5S, 5Y	Primary Key 	70	B	63	87.5	0.318	B	87.5	A	6.94	C	4.17	D	1.39		9	100	Biologia 	¿Cuál de las siguientes medidas NO contribuiría a la conservación de los bosques?	A. Apoyar la expansión de la frontera agrícola sin planificación ni control.	B.  Fomentar el consumo de productos forestales certificados y sostenibles. 	Promover la reforestación y la restauración de ecosistemas degradados	Fortalecer la protección de áreas naturales y parques nacionales.
5	EVALUÁNDONOS 5 FINAL 2025	5-01, 5PJ, 5PU, 5S, 5Y	Primary Key 	71	D	62	86.11	0.368	D	86.11	C	8.33	A	2.78	B	2.78		10		Quìmica 	La siguiente gráfica muestra los diferentes estados de una sustancia en determinadas condiciones de presión y temperatura.	De gas a sólido, porque se disminuye la temperatura manteniendo la presión constante.	De sólido a gas, porque se aumenta la presión manteniendo la temperatura constante.	De sólido a gas, porque se aumenta la temperatura manteniendo la presión constante.	De gas a sólido, porque se aumentan la presión y la temperatura en el sistema.
5	EVALUÁNDONOS 5 FINAL 2025	5-01, 5PJ, 5PU, 5S, 5Y	Primary Key 	72	C	55	76.39	0.517	C	76.39	A	9.72	D	5.56	B	5.56		10		Quìmica 	Para verificar una hipótesis, un estudiante coloca 100 g de agua en una botella, señala con un marcador el nivel donde quedó el agua y procede a colocarla en un congelador. Al día, siguiente, el estudiante observa que el agua cambió a estado sólido y que el nivel del hielo se encuentra por encima de la marca que había hecho en la botella. 	Al envasar una cantidad de agua en una botella el agua cambia de estado.	 El espacio que ocupa una misma masa de agua no es el mismo en estado líquido y en estado sólido.	La temperatura baja hace que el agua cambie de estado líquido a gaseoso.	Al colocar agua en la nevera, sin importar la temperatura, el agua siempre se congela transcurrido un tiempo.
5	EVALUÁNDONOS 5 FINAL 2025	5-01, 5PJ, 5PU, 5S, 5Y	Primary Key 	73	B	53	73.61	0.438	B	73.61	A	13.89	D	8.33	C	4.17		10		Quìmica 	Los átomos de un mismo elemento pueden presentarse en diferentes formas, según su conformación subatómica; por ejemplo:	Como un elemento diferente del átomo 1.	Como un isótopo del átomo 1.	Como un anión del átomo 1.	Como un catión del átomo 1.
5	EVALUÁNDONOS 5 FINAL 2025	5-01, 5PJ, 5PU, 5S, 5Y	Primary Key 	74	A	62	86.11	0.372	A	86.11	B	6.94	C	4.17	D	2.78		10		Quìmica 	Se vierten en el embudo de decantación 4 ml de Tolueno, 3 ml de Formamida, 2 ml de Diclorometano y 1 ml de Cloroformo.  Las densidades de estos líquidos se muestran en la siguiente tabla	 Tolueno	Formamida	 Diclorometano	Cloroformo
5	EVALUÁNDONOS 5 FINAL 2025	5-01, 5PJ, 5PU, 5S, 5Y	Primary Key 	75	A	59	81.94	0.542	A	81.94	D	8.33	C	5.56	B	4.17		10		Quìmica 	 En una empresa de reciclaje se realiza la recolección de botellas plásticas para procesarlas, como se muestra en la siguiente figura.	La masa.	El volumen.	 La composición.	 El estado sólido.
5	EVALUÁNDONOS 5 FINAL 2025	5-01, 5PJ, 5PU, 5S, 5Y	Primary Key 	76	B	63	87.5	0.285	B	87.5	A	9.72	D	1.39	C	1.39		10		Quìmica 	La grafica representa un átomo neutro	16 u.m.a. porque presenta 16 neutrones en el núcleo y 8 electrones. 	8 u.m.a. porque presenta 8 neutrones en el núcleo y 8 electrones. 	16 u.m.a. porque presenta 8 protones y 8 neutrones en su núcleo.	8 u.m.a. porque presenta 4 protones y neutrones en su núcleo.
5	EVALUÁNDONOS 5 FINAL 2025	5-01, 5PJ, 5PU, 5S, 5Y	Primary Key 	77	B	68	94.44	0.252	B	94.44	C	4.17	A	1.39				10		Quìmica 	 En la siguiente tabla, se muestra la configuración electrónica, el grupo en la tabla periódica y algunas propiedades de tres elementos, que se han simbolizado como M, G y T. El número del grupo indica el número de electrones de valencia.	 1s22s22p63s23p6 	1s22s22p63s23p5 	1s22s22p63s23p6 4s2 	1s2 2s2 2p6 3s2 3p6 4s1
5	EVALUÁNDONOS 5 FINAL 2025	5-01, 5PJ, 5PU, 5S, 5Y	Primary Key 	78	D	63	87.5	0.358	D	87.5	B	6.94	C	5.56				10		Quìmica 	Un ion es una especie química que ha ganado o perdido electrones y por lo tanto tiene carga. La configuración electrónica para un átomo neutro "P" con Z = 19 es 1s22s22p63s23p64s1.	1s22s22p63s23p64s2	1s22s22p63s23p6	1s22s22p63s23p5	1s22s22p63s23p64s23d1
5	EVALUÁNDONOS 5 FINAL 2025	5-01, 5PJ, 5PU, 5S, 5Y	Primary Key 	79	C	50	69.44	0.509	C	69.44	B	19.44	D	8.33	A	2.78		10		Quìmica 	La tabla presenta la electronegatividad de 4 elementos:	RS	TU	RU	TR
5	EVALUÁNDONOS 5 FINAL 2025	5-01, 5PJ, 5PU, 5S, 5Y	Primary Key 	80	D	64	88.89	0.271	D	88.89	A	6.94	C	2.78	B	1.39		10		Quìmica 	La tabla presenta la electronegatividad de 4 elementos:	TS	TU	UR	US
5	EVALUÁNDONOS 5 FINAL 2025	5-01, 5PJ, 5PU, 5S, 5Y	Primary Key 	81	C	48	66.67	0.29	C	66.67	A	20.83	D	8.33	B	4.17		10		Biología	Las técnicas modernas de biología molecular nos permiten reemplazar el núcleo de un óvulo fecundado por el núcleo de una célula somática de un organismo adulto.	Con características tanto de la hembra como del donante del núcleo.	Idéntico al adulto de donde se obtuvo el núcleo implantado.	Muy parecido a la madre que aportó el óvulo modificado.	Con la mitad de la información genética de un adulto normal.
5	EVALUÁNDONOS 5 FINAL 2025	5-01, 5PJ, 5PU, 5S, 5Y	Primary Key 	82	B	52	72.22	0.236	B	72.22	A	11.11	D	11.11	C	5.56		10		Biología	A la información genética almacenada en el ADN que se traduce en una secuencia de aminoácidos y posteriormente en proteínas, se le conoce como CÓDIGO GENÉTICO.	Tienen células con membranas internas.	Comparten un antepasado común.	Producen el mismo tipo de proteínas.	Se reproducen sexualmente.
5	EVALUÁNDONOS 5 FINAL 2025	5-01, 5PJ, 5PU, 5S, 5Y	Primary Key 	83	A	62	86.11	0.49	A	86.11	C	6.94	D	5.56	B	1.39		10		Biología	La clasificación de los virus es un punto de discusión en la biología, ya que no se ha establecido si se trata de organismos vivos o no.	No se pueden autorreplicar sin infectar a una célula.	No tienen material genético.	Son muy pequeños.	Tienen proteínas en su estructura.
5	EVALUÁNDONOS 5 FINAL 2025	5-01, 5PJ, 5PU, 5S, 5Y	Primary Key 	84	B	43	59.72	0.53	B	59.72	C	20.83	A	13.89	D	5.56		10		Biología	Los aminoácidos son elementos esenciales en la traducción del ADN. La mayoría de ellos son obtenidos a partir de los alimentos.	Lípidos	Vitaminas	Proteínas	Carbohidratos
5	EVALUÁNDONOS 5 FINAL 2025	5-01, 5PJ, 5PU, 5S, 5Y	Primary Key 	85	B	23	31.94	0.092	A	47.22	B	31.94	C	13.89	D	5.56		10		Biología	Mediante técnicas bioquímicas un biólogo celular determinó la siguiente secuencia de bases nitrogenadas en una hebra de ADN: ADENINA-TIMINA-CITOSINA-GUANINA que estaba siendo transcrita.	ADENINA-TIMINA-CITOSINA-GUANINA	TIMINA-ADENINA-GUANINA-CITOSINA	URACILO-ADENINA-GUANINA-CITOSINA	ADENINA-URACILO-GUANINA-CITOSINA
5	EVALUÁNDONOS 5 FINAL 2025	5-01, 5PJ, 5PU, 5S, 5Y	Primary Key 	86	B	52	72.22	0.142	B	72.22	A	18.06	D	5.56	C	2.78		10		Biología	En una célula animal, las siguientes son las estructuras implicadas en la producción de una proteína de secreción (que sale al exterior): 1. Retículo endoplasmático rugoso, 2. ribosoma, 3. aparato de golgi, 4. membrana celular, 5. ARN, 6. ADN.	6, 5, 2, 3, 1, 4	6, 5, 1, 2, 3, 4	6, 5, 2, 1, 3, 4	6, 5, 2, 1, 3, 4
5	EVALUÁNDONOS 5 FINAL 2025	5-01, 5PJ, 5PU, 5S, 5Y	Primary Key 	87	C	40	55.56	0.028	C	55.56	A	23.61	B	19.44		1.39		10		Biología	El ser vivo está formado por macromoléculas que generalmente son polímeros, esto es, moléculas, formadas por la unión de varias moléculas pequeñas similares. Así, los ácidos nucleicos son cadenas de nucleótidos, las proteínas cadenas de aminoácidos y los polisacáridos cadenas de azúcares simples.	Aminoácidos	Ácidos grasos	Nucleótidos	Monosacáridos
5	EVALUÁNDONOS 5 FINAL 2025	5-01, 5PJ, 5PU, 5S, 5Y	Primary Key 	88	B	47	65.28	0.235	B	65.28	A	19.44	C	8.33	D	5.56		10		Biología	Una mutación es el cambio de uno o varios nucleótidos del ADN de un individuo.	Cambió el número de cromosomas.	Hubo formación de células haploides.	No ocurrió síntesis de proteínas.	Se sintetizó una proteína diferente a la esperada.
5	EVALUÁNDONOS 5 FINAL 2025	5-01, 5PJ, 5PU, 5S, 5Y	Primary Key 	89	B	41	56.94	0.323	B	56.94	C	18.06	A	16.67	D	8.33		10		Biología	Las células eucariotas realizan tres procesos fundamentales para su mantenimiento y reproducción: la replicación, la transcripción y la traducción. En un experimento con animales se modifica una de las moléculas que intervienen en estos procesos.	ADN	ARN	ATP	Proteína
5	EVALUÁNDONOS 5 FINAL 2025	5-01, 5PJ, 5PU, 5S, 5Y	Primary Key 	90	A	45	62.5	0.346	A	62.5	B	22.22	C	9.72	D	5.56		10		Biología	Las proteínas son sustancias utilizadas para la regeneración de los tejidos.	Las vacuolas	El aparato de Golgi	Los ribosomas	Los lisosomas
6	EVALUÁNDONOS 6 FINAL 2025	6-01, 6-02, 6-03, 6PJ	Primary Key 	1	B	40	58.82	0.482	B	58.82	A	19.12	C	11.76	D	10.29		11		QUIMICA 	      Es considerado como todo aquello que tiene masa y ocupa un lugar en el espacio. Básicamente, es aquello de lo que está hecho todo el universo físico: desde las estrellas hasta un granito de arena o si se quiere ser más específico hasta un átomo que es considerada la partícula más pequeña que existe en nuestro universo.	Energía	Materia	Respuesta A y B son incorrectas	 Respuestas A y C con correctas
6	EVALUÁNDONOS 6 FINAL 2025	6-01, 6-02, 6-03, 6PJ	Primary Key 	2	D	16	23.53	0.071	B	42.65	D	23.53	A	19.12	C	14.71		11		QUIMICA 	     Se define fundamentalmente como la capacidad de un sistema o cuerpo para realizar un trabajo. No es una sustancia material, sino una propiedad que permite producir cambios en la materia, como el movimiento, la variación de temperatura o la emisión de luz.	Materia 	Energia 	Luz	Respuestas A y C son correctas 
6	EVALUÁNDONOS 6 FINAL 2025	6-01, 6-02, 6-03, 6PJ	Primary Key 	3	C	22	32.35	-0.016	C	32.35	A	25	D	25	B	17.65		11		QUIMICA 	     Son considerados como las distintas formas físicas en que se presenta la materia, definidas por la fuerza de unión entre sus partículas. Las principales formas son: solido (se caracteriza por tener forma y volumen fijo), liquido ( se caracteriza por tener un  volumen fijo y forma variable), gaseoso (se caracteriza por tener una forma y volumen variable) y finalmente el plasma ( se caracteriza por ser un gas ionizado a alta temperatura).	  Los tres estados de agregación de la materia 	 Los cuatro estados de agregación de la materia	 Los tres cambios que puede tener la materia	 La respuesta A y C son correctas 
